{
  "$schema": "https://json-schema.org/draft/2020-12/schema",
  "$id": "https://cosmic-vikings/ar-agent/contracts/validation-result.schema.json",
  "title": "ValidationResult",
  "description": "Outcome of validating an input/payload against a contract schema. Carries AR_VALIDATION_* codes (§9). Returned by validation nodes and by the IdempotencyKeyComponent / envelope checks.",
  "x-contract-version": "1.0.0",
  "x-status": "draft",
  "x-since": "2026-07-06",
  "type": "object",
  "additionalProperties": false,
  "required": ["valid", "contract_name", "contract_version", "trace_id"],
  "properties": {
    "valid": {"type": "boolean", "description": "True iff the payload satisfied the contract schema and all rules."},
    "contract_name": {"type": "string", "minLength": 1, "description": "Name of the contract the payload was validated against (e.g. InvoiceData)."},
    "contract_version": {"type": "string", "pattern": "^\\d+\\.\\d+\\.\\d+$", "description": "Version of the contract the payload was validated against."},
    "trace_id": {"type": "string", "minLength": 1},
    "errors": {
      "type": "array",
      "items": {"$ref": "#/$defs/issue"},
      "description": "Present when valid=false."
    },
    "warnings": {
      "type": "array",
      "items": {"$ref": "#/$defs/issue"},
      "description": "Non-blocking issues."
    },
    "validated_at": {"type": "string", "pattern": "^\\d{4}-\\d{2}-\\d{2}T\\d{2}:\\d{2}:\\d{2}Z$"},
    "schema_ref": {"type": "string", "minLength": 1, "description": "$id of the schema used."}
  },
  "$defs": {
    "issue": {
      "type": "object",
      "additionalProperties": false,
      "required": ["path", "code", "message"],
      "properties": {
        "path": {"type": "string", "minLength": 1, "description": "JSON pointer to the offending field (e.g. /data/amount)."},
        "code": {"type": "string", "pattern": "^AR_VALIDATION(_[A-Z_]+)?$", "description": "Stable AR_VALIDATION_* code (§9)."},
        "message": {"type": "string", "minLength": 1, "description": "Human-readable; no raw stack traces (§9)."},
        "rule_id": {"type": "string", "minLength": 1, "description": "The validation rule id that failed."}
      }
    }
  }
}